{
  "id": "550e8400-e29b-41d4-a716-446655440800",
  "organization_id": "550e8400-e29b-41d4-a716-446655440001",
  "project_id": "550e8400-e29b-41d4-a716-446655440400",
  "user_id": "550e8400-e29b-41d4-a716-446655440100",
  "billable_rate": null,
  "created_at": "2026-01-05T00:00:00Z",
  "updated_at": "2026-01-05T00:00:00Z"
}
